,clinic,date,rating,title,comment,comment_wo_stopwords
538,Hazeldene Medical Group Practice,2022-10-12,5.0,"best phone call ever made
    ","i called on behalf of my father to schedule an appointment to see his primary doctor for a check-up, spoke with a very pleasant woman who listened to my story and concerns, she addressed everything very promptly and professionally. not only was this the best phone call ever made in my life, but i also couldn't be happier with the level of service i was provided. she is a viable asset to this staff.",called behalf father schedule appointment see primary doctor checkup spoke pleasant woman listened story concerns addressed everything promptly professionally best phone call ever made life also happier level service provided viable asset staff
539,WATLING MEDICAL CENTRE Stanmore,2022-11-29,1.0,"Horrible receptionist
    ","i was trying to ask questions to find out more about the services the gp surgery provides and it was like the receptionist couldn’t wait to end the call. she was continuously interrupting me, giving blunt answers and speaking down to me. it was not an informative call and i don’t feel comfortable signing up to a surgery where this is the kind of service that can be expected. ",trying ask questions find services gp surgery provides like receptionist couldn’t wait end call continuously interrupting me giving blunt answers speaking me informative call don’t feel comfortable signing surgery kind service expected
540,WATLING MEDICAL CENTRE Stanmore,2022-10-18,1.0,"Problem to book appointments
    ","i have a preference to see one particular doctor in the surgery and i would be happy to take a day off work to see them, but the system of booking appointments is extremely unhelpful. it is a gamble at 8:30 every morning, you wait an hour for your turn and may or may not get an appointment, and have zero choice over doctors. i cannot take days off work in hopes of seeing a doctor. there should be an advance booking system and not a lucky draw at 8:30 every morning. ",preference see one particular doctor surgery would happy take day work see them system booking appointments extremely unhelpful gamble 830 every morning wait hour turn may may get appointment zero choice doctors cannot take days work hopes seeing doctor advance booking system lucky draw 830 every morning
541,WATLING MEDICAL CENTRE Stanmore,2022-06-01,2.0,"Appointment
    ",after 1:55min on the phone waiting for an appointment. they didn't give me any instead the receptionist hang-up on the call. this was very frustrating and it is not the first time this happens,155min phone waiting appointment give instead receptionist hangup call frustrating first time happens
542,WATLING MEDICAL CENTRE Stanmore,2022-05-23,1.0,"Bad reception support 
    ","waiting on line and getting help from this surgery it very difficult 
the reception staff are not helpful and sometimes very rude and aggressive
i have trying to give a message to the doctors but i’m not able to i have contacted the surgery more then 5 times and each time holding on line for almost 45 minutes, i just don’t know how to reach my dr. this is very very bad service 
  ",waiting line getting help surgery difficult reception staff helpful sometimes rude aggressive trying give message doctors i’m able contacted surgery 5 times time holding line almost 45 minutes don’t know reach dr bad service
543,WATLING MEDICAL CENTRE Stanmore,2022-04-29,5.0,"Wonderful care
    ","my family and i have been patients at the practice for many years and have always received a very good service. i had health issues during the pandemic (besides covid) and was seen very quickly and given excellent care by the gps, nurses and reception staff. the gps listen to me and call when they say they will. we feel extremely lucky to be patients here.  thank you for the service you are giving.  it's a tough times for gps, look after yourselves too.  ",family patients practice many years always received good service health issues pandemic besides covid seen quickly given excellent care gps nurses reception staff gps listen call say will feel extremely lucky patients here thank service giving tough times gps look too
544,WATLING MEDICAL CENTRE Stanmore,2022-02-15,2.0,"Government should start looking into Gp practices.
    ","short story: broke my little toe, called 112 for advice ( i didn't want them to send an ambulance, are many others out there with bigger issues) i told them i'm just 5 minutes away from my gp and they have been happy if i can get there. so i went to gp, it was an emergency, the answer was. sorry, we cannot help you. so what's the point to have a gp, it cannot help you? in my humble opinion, gp's are just for business, aren't part of nhs with heart. just for money. government should start looking into gp practices. they are a joke... then i went back home called 111, had a video chat and the problem is sorted. well, i still have a broken little toe, but they ensure me i won't get gangrene. so except for the fact, i jump around like a kangaroo. all good.  looking forward to changing the gp...  fun fact are all same.",short story broke little toe called 112 advice  want send ambulance many others bigger issues told im 5 minutes away gp happy get there went gp emergency answer was sorry cannot help you whats point gp cannot help you humble opinion gps business part nhs heart money government start looking gp practices joke went back home called 111 video chat problem sorted well still broken little toe ensure get gangrene except fact jump around like kangaroo good looking forward changing gp fun fact same
545,WATLING MEDICAL CENTRE Stanmore,2021-11-06,1.0,"Very Bad
    ",there is a serious problem with the phone system with this practice.  despite calling everyday at 8:30 am for a more than a week i was still not able to arrange a call with a dr because the large number of people calling at the same time trying to get a slot. despite waiting 2 hours each time when my turn came there was never any slot left.  i have now been waiting for a month to get a urgent prescription. eventually i was told that a dr would call me back and discuss the prescription but no one ever did.  i waited over 8 hours on the phone this week alone.  the management need to act on this. clearly the doctors in this practice are struggling with the numbers and can not provide a descent basic service. this is not acceptable and potentially dangerous for the patients who are not followed up as they should. i can not imagine being the only person in this situation. at this time i’m still trying to get a dr phone appointment.,serious problem phone system practice despite calling everyday 830 week still able arrange call dr large number people calling time trying get slot despite waiting 2 hours time turn came never slot left waiting month get urgent prescription eventually told dr would call back discuss prescription one ever did waited 8 hours phone week alone management need act this clearly doctors practice struggling numbers provide descent basic service acceptable potentially dangerous patients followed should imagine person situation time i’m still trying get dr phone appointment
546,WATLING MEDICAL CENTRE Stanmore,2021-09-20,5.0,"Thank you
    ","wanted to say thank you to the whole team at watling during the covid times. from myself having prescriptions dealt with quickly, to assessing my sick children over the last few months and providing vaccinations and baby checks with ease.",wanted say thank whole team watling covid times prescriptions dealt quickly assessing sick children last months providing vaccinations baby checks ease
547,WATLING MEDICAL CENTRE Stanmore,2021-02-18,5.0,"Excellent, Professional and very friendly 
    ","i got invited for the pfizer vaccination, booked for next day and got the vaccination.  they are very well organised, very friendly and professional.  i had no side effects, just a slight discomfort on the arm for one day. 
recommend this centre highly. 
arun soni  ",got invited pfizer vaccination booked next day got vaccination well organised friendly professional side effects slight discomfort arm one day recommend centre highly arun soni
548,WATLING MEDICAL CENTRE Stanmore,2021-03-10,2.0,"Reception staff
    ",one of your members of staff has no telephone manner and is very rude !!! i can see im not the only person to say this ,one members staff telephone manner rude  see im person say
549,The Stanmore Medical Centre,2022-10-11,1.0,"The worst Answering Service 
    ","45 minutes and finally gave up waiting to book an appointment .... "".. you are next in the que"" message for over 20 minutes",45 minutes finally gave waiting book appointment   next que message 20 minutes
550,The Stanmore Medical Centre,2022-10-11,2.0,"Crowshot Avenue  surgery 
    ","i call up to as i need to arrange an appointment for my parents who has no access on. line. i was told by the receptionist i can do this as it takes time and other patients are wait for a call , i held on for about 10 minutes, and told her i can’t log in as it’s not available. receptionist refused me and but the phone down , yet on the answer machine and on there websites says people with no internet access we  can do it by phone.
the receptionist put the phone down on me !! how rude can they get just no one wants to do their jobs probably and sufficiently. very disappointed with this surgery and there rudenesses.",call need arrange appointment parents access on line told receptionist takes time patients wait call  held 10 minutes told can’t log it’s available receptionist refused phone  yet answer machine websites says people internet access phone receptionist put phone  rude get one wants jobs probably sufficiently disappointed surgery rudenesses
551,The Stanmore Medical Centre,2022-08-25,5.0,"How GP practice should be.
    ","today when attending for a blood test, i enquired if i may also have my psa test which had been delayed due to covid and within minutes given the go ahead.
similarly when asked if a follow up enquiry for my pain consultant could be ascertained, that enquiry was confirmed and a response will be received within 48 hours.
all of this with a polite kindness and a really pleasent attitude.",today attending blood test enquired may also psa test delayed due covid within minutes given go ahead similarly asked follow enquiry pain consultant could ascertained enquiry confirmed response received within 48 hours polite kindness really pleasent attitude
552,The Stanmore Medical Centre,2022-08-06,5.0,"Highly efficient and responsive
    ","this review relates to my annual review of medications with the practice.  from start to finish, the doctor could not have been more responsive and efficient.  the “on line” services and via text worked extremely well with almost instantaneous responses.  my blood test and follow up appointments with the practice nurse took place on time with no waiting and the nurse took the time to patiently run through the results in some detail and made good recommendations.   the doctor appointments were fixed efficiently and the phone consultations were very good and suited me well given work constraints.  at all times the doctor, receptionists and nurse could not have been more pleasant and professional, particularly bearing in mind the stresses this busy practice must be facing.  thank you, thank you, thank you!   i am lucky to belong to such a caring and efficient practice which is a credit to the nhs, which is so frequently the subject of harsh criticism. ",review relates annual review medications practice start finish doctor could responsive efficient “on line” services via text worked extremely well almost instantaneous responses blood test follow appointments practice nurse took place time waiting nurse took time patiently run results detail made good recommendations doctor appointments fixed efficiently phone consultations good suited well given work constraints times doctor receptionists nurse could pleasant professional particularly bearing mind stresses busy practice must facing thank you thank you thank you lucky belong caring efficient practice credit nhs frequently subject harsh criticism
553,The Stanmore Medical Centre,2022-06-20,1.0,"Arrogant
    ",i have covid and i am ill. have not once bothered my gp over this. i get a call 2h 45 mins late with no apology. i have to work online when gp calls. i cannot reschedule. he offers no explanation. i questioned why. he hangs up on me. no duty of care whatsoever. i am appalled and disgusted. website is also down. you can only use website. i had to call and wait 40 mins to speak to someone. ,covid ill bothered gp this get call 2h 45 mins late apology work online gp calls cannot reschedule offers explanation questioned why hangs me duty care whatsoever appalled disgusted website also down use website call wait 40 mins speak someone
554,The Stanmore Medical Centre,2022-06-28,5.0,"Great practicehave
    ",have received excellent  help from this practice. filled out  klinik form dr.called same day and was seen an hour later. also  received  flow up call to see how  i was getting on with my  problem.,received excellent help practice filled klinik form drcalled day seen hour later also received flow call see getting problem
555,The Stanmore Medical Centre,2022-06-20,5.0,"Great practice
    ","brilliant online service. for non-urgent medical care, this is a fast and service to offer. i sent my online referral in the morning and within 30 minutes i had a response. i was asked to send in pictures and answered the doctors questions.",brilliant online service nonurgent medical care fast service offer sent online referral morning within 30 minutes response asked send pictures answered doctors questions
556,The Stanmore Medical Centre,2022-05-06,5.0,"Great caring Drs and reception
    ",receptionist are very helpful caring supporting ever ready to help and very professionals. drs appointments  are booked on a new system . prescriptions are dealt quite quickly. main advantage and greatness is drs don’t rush they do listen to problems and issues and then deal. if the issue is urgent then a quick response follows . if one can not use online system then receptions for help. the nurses and blood testing staff is excellent and very helpful. glad to be with this surgery for a long time and had never any issue. but always had compliments . wishing all the staff and drs best wishes and sincere thanks for thei kind and timely help. ,receptionist helpful caring supporting ever ready help professionals drs appointments booked new system  prescriptions dealt quite quickly main advantage greatness drs don’t rush listen problems issues deal issue urgent quick response follows  one use online system receptions help nurses blood testing staff excellent helpful glad surgery long time never issue always compliments  wishing staff drs best wishes sincere thanks thei kind timely help
557,The Stanmore Medical Centre,2022-04-18,5.0,"Great Community GP…A+++
    ","i’ve been with this gp surgery for many years, and all the staff at this surgery are very friendly, and always deal with queries promptly despite the recent covid-19 challenges. staff always go above and beyond for me if i have a medical or administrative query. i would have no hesitation in recommending this practice to other’s 🙂🙂🙂 

thanks very much again.",i’ve gp surgery many years staff surgery friendly always deal queries promptly despite recent covid19 challenges staff always go beyond medical administrative query would hesitation recommending practice other’s 🙂🙂🙂 thanks much again
558,The Stanmore Medical Centre,2022-05-09,1.0,"Impossible to contact
    ","i have been trying for 30 minutes to call the surgery. tried to book an appointment online, to no avail. how on earth do i contact my gp? can not do it online or by phone?",trying 30 minutes call surgery tried book appointment online avail earth contact gp online phone
559,The Stanmore Medical Centre,2022-03-01,4.0,"Receptionist and Doctors 
    ","i would like to say thank you to lady from reception 01/03/22 . very professional, polite service. i was impressed . ",would like say thank lady reception 010322  professional polite service impressed 
560,The Stanmore Medical Centre,2022-03-15,1.0,"Wrong appointment. 
    ","shambles service. arrived for a smear test and then told a mix up as the receptionist had booked me in for a blood test instead. booked on the specific day as had a day off. 
was told i had to rebook. wasn’t offered to be squeezed in or anything . 
how difficult to get an appointment right. 
not happy. ",shambles service arrived smear test told mix receptionist booked blood test instead booked specific day day off told rebook wasn’t offered squeezed anything  difficult get appointment right happy
561,The Stanmore Medical Centre,2022-03-29,5.0,"Very responsive practice 
    ","i realised that i had gone away and forgotten one of my medications.
i sent an urgent message at 08:45 and received a text back at 11:20 the same morning to say that my medication had been sent to the pharmacy where i am staying.

incredible fast and responsive surgery.
i’ve always felt very safe and cared for.
thank you so much for organising this so fast for me, saving me anxiety and potentially serious side effects from not taking this medication.

",realised gone away forgotten one medications sent urgent message 0845 received text back 1120 morning say medication sent pharmacy staying incredible fast responsive surgery i’ve always felt safe cared for thank much organising fast me saving anxiety potentially serious side effects taking medication
562,The Stanmore Medical Centre,2021-11-15,5.0,"Awesome Team
    ","as a family, we have been really happy with the help and support we have received, especially over the pandemic period. the move to online has been great for us and our queries/ concerns have been addressed expeditiously. in many cases, especially with the children, the doctors have gone over and above to help us on top of all the admin and other work that comes with being a gp, to check in that something (eg a referral) has been actioned. 
thank you for making a tough time that little bit more straight forward. ",family really happy help support received especially pandemic period move online great us queries concerns addressed expeditiously many cases especially children doctors gone help us top admin work comes gp check something eg referral actioned thank making tough time little bit straight forward
563,The Stanmore Medical Centre,2021-10-08,5.0,"Wonderful Doctors
    ",i have nothing but praise for the doctors at smc for the caring and efficient manner they have dealt with my medical issues.  the pandemic must have been very testing for them and they have come up trumps in the diligent and sensitive way they have still been there for all of us. it can’t have been easy so a massive thank you from a very grateful patient. ,nothing praise doctors smc caring efficient manner dealt medical issues pandemic must testing come trumps diligent sensitive way still us can’t easy massive thank grateful patient
564,The Stanmore Medical Centre,2021-10-07,4.0,"Great Doctors
    ",the doctors were caring and efficient in dealing with arranging hospital medical tests in what must be very pressurised and busy pandemic times.  ,doctors caring efficient dealing arranging hospital medical tests must pressurised busy pandemic times
565,The Stanmore Medical Centre,2021-09-01,5.0,"Excellent GP
    ","my gp is always attentive, courteous and prompt and i also believe she does the best she can in the circumstances. she is very good at diagnosis, wants to get it right, further treatment actions and follow up. well done and all the best to you!",gp always attentive courteous prompt also believe best circumstances good diagnosis wants get right treatment actions follow up well done best you
566,The Stanmore Medical Centre,2021-09-21,5.0,"Great service 
    ","with all of the negative comments about gps i would like to say how impressed i have been with stanmore medical centre. on the few occasions my husband or i have contacted them via their website, we have had an email response within hours and follow up phone call from a doctor within hours of that. we are really delighted!  thank you !",negative comments gps would like say impressed stanmore medical centre occasions husband contacted via website email response within hours follow phone call doctor within hours that really delighted thank 
567,The Stanmore Medical Centre,2021-06-25,5.0,"Very Happy at SMC
    ","family of 4 been with stanmore med centre for 14 years - we've always been very happy, i've never found the receptionists rude and i've found almost all the doctors excellent and they listen, which is key . i have high standards and work in a healthcare practice so i know how it us to be on the flip side of the experience. 

i want to comment in particular on yesterday and the efficiency of the staff, they were excellent. i used the new klinik triage form online, was cutting it fine as it was 2.55pm when submitted and 3pm is the day cut off for 'that day' triage. my 12 y/o son was really poorly, high fever, headache, general malaise and very sore throat. withing 15 minutes i had a call back from a receptionist who informed me that a gp advised an emergency appointment. 20 minutes later and we had an in-person consultation with a lovely gp at the outreach clinic. my son has been diagnosed with tonsilitis and is on antibiotics, so peace of mind for me and he is on the mend today. this is the 2nd time i have used the klinik triage form, the other time was last week for a non urgent matter and i still had a call from one of smcs excellent doctor's 1 hour after submission of the form. well done stanmore medical centre! ",family 4 stanmore med centre 14 years  weve always happy ive never found receptionists rude ive found almost doctors excellent listen key  high standards work healthcare practice know us flip side experience want comment particular yesterday efficiency staff excellent used new klinik triage form online cutting fine 255pm submitted 3pm day cut that day triage 12 yo son really poorly high fever headache general malaise sore throat withing 15 minutes call back receptionist informed gp advised emergency appointment 20 minutes later inperson consultation lovely gp outreach clinic son diagnosed tonsilitis antibiotics peace mind mend today 2nd time used klinik triage form time last week non urgent matter still call one smcs excellent doctors 1 hour submission form well done stanmore medical centre
568,The Stanmore Medical Centre,2021-06-28,5.0,"Thank you!  Amazing service
    ","my husband was discharged from northwick park hospital on friday evening after a procedure.  they sent him home with a bag of surgical dressings which he duly handed to me whereby after 48 hours i was to inspect the wound and change the dressing !!!  well, i can do most things, but i definitely couldn’t do that, even for hubby.   thanks a million to our practice nurse who saw him a short notice today and carried out the necessary work.   that’s  what i call excellent attention!  many thanks from both of us, we really appreciated your help.",husband discharged northwick park hospital friday evening procedure sent home bag surgical dressings duly handed whereby 48 hours inspect wound change dressing  well things definitely couldn’t that even hubby thanks million practice nurse saw short notice today carried necessary work that’s call excellent attention many thanks us really appreciated help
569,The Stanmore Medical Centre,2021-06-29,4.0,"POLITE AND HELPFUL RECEPTIONIST
    ","my most recent visit was a pleasant one, contrary to previous ones quite often. the receptionist was most helpful and receptive and sorted my problem immediately with a pleasant smile. keep it up stanmore medical centre and keep smiling.",recent visit pleasant one contrary previous ones quite often receptionist helpful receptive sorted problem immediately pleasant smile keep stanmore medical centre keep smiling
570,The Stanmore Medical Centre,2021-07-12,3.0,"Klinx 
    ","staff is very good, doctors are amazing, but i dont know nhs should check the software they are using for patients, its very complicated.
we are living in a multicultural society and some of the old people dont have an internet access, phone line are always busy, its next to impossible to get hold of their reception staff until or unless you go the surgery. some peolpe cant explain their problem, but in order to get a medical help they have to fill this form which i beileve is not appropriate for the patients.",staff good doctors amazing dont know nhs check software using patients complicated living multicultural society old people dont internet access phone line always busy next impossible get hold reception staff unless go surgery peolpe cant explain problem order get medical help fill form beileve appropriate patients
571,The Stanmore Medical Centre,2021-06-27,5.0,"Great Service
    ",i completed the klinik form in the afternoon and it was dealt with by the doctor with half an hour and a prescription went to my pharmacy.  very impressed that the practice dealt with my problem so efficiently.,completed klinik form afternoon dealt doctor half hour prescription went pharmacy impressed practice dealt problem efficiently
