,clinic,date,rating,title,comment,comment_wo_stopwords
0,Forty Willows Surgery,2022-10-04,5.0,"Amazing practice 
    ",this doctor's is very good. please be polite to everyone because they are doing a stressful job and they try their best to help you. this doctor's has got everything rite . reception are the really good hopefully and polite they really are good. now the doctor's they really are the best . from reception to social prescriber nurses and doctor's you are all doing a amazing job and i thank you all . stay safe and look after yourself thanks again mark lidbetter ,doctors good please polite everyone stressful job try best help you doctors got everything rite  reception really good hopefully polite really good doctors really best  reception social prescriber nurses doctors amazing job thank  stay safe look thanks mark lidbetter
1,Forty Willows Surgery,2022-05-09,5.0,"Exceptional staff and doctors
    ","i wanted to post this feedback about my visits to the surgery in the past month and the staff has been absolutely amazing with the attention and care they have provided me. i see new faces and miss old faces. 

i've been served timely appointments, courteous manner over the phone when i've called, helpful and caring with my repeat prescriptions and most important your staff actually mention to me if there is anything else they can do to help me!!  

i visited today for my blood test and your staff wished me a happy birthday! receptionists and nurses and even a lovely patient who overheard the staff wishing me happy birthday! 

surgery receptionists have been exceptionally brilliant and have booked appointments to see the doctor, and blood test appointments, and today one receptionist didn't allow me to leave without seeing the hca for my blood pressure because she checked the system and saw it was long overdue - i find this to be exceptionally brilliant patient care. 

well done to forty willows team! ",wanted post feedback visits surgery past month staff absolutely amazing attention care provided me see new faces miss old faces ive served timely appointments courteous manner phone ive called helpful caring repeat prescriptions important staff actually mention anything else help me visited today blood test staff wished happy birthday receptionists nurses even lovely patient overheard staff wishing happy birthday surgery receptionists exceptionally brilliant booked appointments see doctor blood test appointments today one receptionist allow leave without seeing hca blood pressure checked system saw long overdue  find exceptionally brilliant patient care well done forty willows team
2,Forty Willows Surgery,2021-12-07,5.0,"Understanding Of Menopause 
    ","used the e consult form to begin with and was offered a face to face appointment. brilliant all round understanding of the condition, listened to me & offered help.  asked to record my consultation for training purposes which i was really happy with as i am all for education.  followed up my face to face appointment with a phone call. doctor and receptionist i dealt with really restored my faith in the practice that had been waning. i would say to anyone on the subject of menopause, do your homework and forty willows practice will help you through the process. would now highly recommend ",used e consult form begin offered face face appointment brilliant round understanding condition listened  offered help asked record consultation training purposes really happy education followed face face appointment phone call doctor receptionist dealt really restored faith practice waning would say anyone subject menopause homework forty willows practice help process would highly recommend
3,Forty Willows Surgery,2021-06-24,1.0,"I cannot believe the surgery doors are opened 
    ","avoid this surgery , just like the above and below reviews. 
 i called just like the receptionist tell you 
at 8am and 2pm there is never appointments 
i cannot believe when i rang and said i want to book as i have been trying to get an appointment for the last week and no success so i explained and said can i have a one in the one week or the next slot 
response was i have also nothing prebookable 
doctors appointments can be only booked 2 weeks in advance. 
the week or to before i got sent a text message saying please contact the surgery reception to discuss a test result i rang and they said they have nothing to book 
at this point can you even blame me for being frustrated and angry 
why is the staff allowed to send sms or call patients if there is no where to book them , what surgery honestly work this way i do not understand , over the years the surgery has gone worst i'm not sure due to the new partners or the management , you ask for a manager and she never takes a call , i actually feel for the receptionist that they seem to have no support from the management . i decided to turn up at the surgery to a patient before me kicking of a major fuss for the same thing as me and i was absolutely disgusted that a surgery can operate this way , i witnessed on how the receptionist felt and no care of management to even avoid this sort of behaviour . despite on how angry i was i was absolutely respectful towards the staff at reception as i feel they can only do what they instructed to do  . how on earth is this patient care ? 
i’m currently looking for another surgery 
bad experience 


  

",avoid surgery  like reviews called like receptionist tell 8am 2pm never appointments cannot believe rang said want book trying get appointment last week success explained said one one week next slot response also nothing prebookable doctors appointments booked 2 weeks advance week got sent text message saying please contact surgery reception discuss test result rang said nothing book point even blame frustrated angry staff allowed send sms call patients book  surgery honestly work way understand  years surgery gone worst im sure due new partners management  ask manager never takes call  actually feel receptionist seem support management  decided turn surgery patient kicking major fuss thing absolutely disgusted surgery operate way  witnessed receptionist felt care management even avoid sort behaviour  despite angry absolutely respectful towards staff reception feel instructed  earth patient care  i’m currently looking another surgery bad experience
4,Forty Willows Surgery,2021-06-21,1.0,"Avoid this surgery 
    ","i do not understand why this surgery doors are still opened 
they do not have the capability to look after all these patient’s 
there are never appointments , the receptionist staff ms chandni is brilliant she seems to sort all these problems that the rest of the staff do the rest do not understand the basics of what you tell them , i believe she is very well to good for this surgery 
you call at 8am they never have appointment you try at 2pm you have the same excuses 
you can never get an appointment with dr paul nor dr prasad 
the surgery reputation has gone downhill after these 5 years 
i do not seem to understand why the doors remain open 
you ask to speak to the manager you hear repeatedly she is in a meeting 
im in the process of changing my gp surgery 

",understand surgery doors still opened capability look patient’s never appointments  receptionist staff ms chandni brilliant seems sort problems rest staff rest understand basics tell  believe well good surgery call 8am never appointment try 2pm excuses never get appointment dr paul dr prasad surgery reputation gone downhill 5 years seem understand doors remain open ask speak manager hear repeatedly meeting im process changing gp surgery
5,Forty Willows Surgery,2021-06-26,5.0,"Caring Sensitive Doctor
    ","
the helpful lady doctor who took the trouble to phone me earlier today was really reassuring and helpful,  she took the time to listen to me. i really did appreciate this, and feel so much better now.",helpful lady doctor took trouble phone earlier today really reassuring helpful took time listen me really appreciate this feel much better now
6,Forty Willows Surgery,2021-05-18,5.0,"It does not get any better
    ","i have registered recently. everything went smoothly from the registration until sorting out my covid vaccination. things were efficient and i was informed all throughout, including signup to online services - which is a great convenience in these pandemic times. staff have been very friendly and did their best helping despite the very difficult circumstances they have faced this last year. the only way my needs could be better served is if they invited me for coffee in the mornings but i don't think that's an option for a while now. i would love to join the ppg once it is back again.",registered recently everything went smoothly registration sorting covid vaccination things efficient informed throughout including signup online services  great convenience pandemic times staff friendly best helping despite difficult circumstances faced last year way needs could better served invited coffee mornings think thats option now would love join ppg back again
7,Forty Willows Surgery,2021-02-19,1.0,"Extremaly unprofessional
    ","avoid this gp at all cost’s !!! they are extremely unprofessional and neglect their patients.
they can’t follows the simplest instructions when laid out for them in black and white.
i have been in this country for 5 years and when i arrived i spoke no english, my english is now better than this doctor who is supposed to be looking after us as patients.
i have been ringing them every day to get a fit to fly letter of which i had specifically said what it needs to say, and they charged me for this service when this was only mentioned after the 3rd attempt.
i still to this day have not have not received the correct paper work.",avoid gp cost’s  extremely unprofessional neglect patients can’t follows simplest instructions laid black white country 5 years arrived spoke english english better doctor supposed looking us patients ringing every day get fit fly letter specifically said needs say charged service mentioned 3rd attempt still day received correct paper work
8,Forty Willows Surgery,2021-02-23,4.0,"Good receptionist 
    ","i have had a wonderful experience at this gp surgery because of the receptionist. she has made it very easy to communicate on phone calls as well as getting appointments when doctors are available. the receptionist is helpful and kind, as well as being considerate. ",wonderful experience gp surgery receptionist made easy communicate phone calls well getting appointments doctors available receptionist helpful kind well considerate
9,Forty Willows Surgery,2021-02-17,1.0,"Terrible communication
    ",booked an e consult online but missed the phone call. gp had left a voicemail saying to phone the surgery and book it in again. spent over an hour waiting to be put through only for a the rude receptionist to say she’s not able to book anything i should phone back at half 8 in the morning. i relayed to her the message the gp had left on my phone to which she responded are you going to let me talk or not. i thought she was very rude and unprofessional. currently looking for a new gp! ,booked e consult online missed phone call gp left voicemail saying phone surgery book again spent hour waiting put rude receptionist say she’s able book anything phone back half 8 morning relayed message gp left phone responded going let talk not thought rude unprofessional currently looking new gp
10,Mollison Way Surgery,2022-10-27,1.0,"This place is absolutely awful
    ","so when using the dr iq app it always seems to say there are no more online consultations available today and that's even at 10am in the morning. 
my disabled mum had a telephone appointment and the doctor never called her. she had a very bad infection which they could not see her for so had to take her to urgent care. i have seen people go in there to complain that's things have not been taken care of even after a few months. 
the staff are great at giving excuses and don't seem to know what they are doing. 
now it may not be totally their fault and occurs at other practices but it needs to be sorted as patients ultimately suffer!!!!",using dr iq app always seems say online consultations available today thats even 10am morning disabled mum telephone appointment doctor never called her bad infection could see take urgent care seen people go complain thats things taken care even months staff great giving excuses seem know doing may totally fault occurs practices needs sorted patients ultimately suffer
11,Mollison Way Surgery,2022-10-10,5.0,"best practice
    ",i find the surgery very prompt in services dr iq app specially very efficient and swift in communicating with doctors and pharmacist and reception staff,find surgery prompt services dr iq app specially efficient swift communicating doctors pharmacist reception staff
12,Mollison Way Surgery,2022-10-06,5.0,"excellent practice
    ",staff of this gp surgery is very friendly and helpful. i am getting good treatment from doctors and nurse.,staff gp surgery friendly helpful getting good treatment doctors nurse
13,Mollison Way Surgery,2022-10-20,5.0,"great preactice
    ",its very easy to use dr iq and doctor responds quickly. appointment are given on the same day and your issues are seen professionally.,easy use dr iq doctor responds quickly appointment given day issues seen professionally
14,Mollison Way Surgery,2022-09-27,5.0,"regular good service
    ",i am getting regular good service from mollison way surgery and doctors and staff are very helpful and friendly.,getting regular good service mollison way surgery doctors staff helpful friendly
15,Mollison Way Surgery,2022-09-23,5.0,"happy with the practice
    ",i am very happy with gp services particularly with doctors and reception staff who treat us very politely and good manner. ,happy gp services particularly doctors reception staff treat us politely good manner
16,Mollison Way Surgery,2022-09-28,5.0,"attentive practice
    ",this surgery has very attentive staff and doctors.  i am happy with the services provided here. i would recommend if you can recruit more staff to make it better.,surgery attentive staff doctors happy services provided here would recommend recruit staff make better
17,Mollison Way Surgery,2022-05-13,5.0,"excellent
    ",i visited this surgery and saw a particular doctor who was very helpful and listened to your problems. and i highly recommend it to friends and family,visited surgery saw particular doctor helpful listened problems highly recommend friends family
18,Mollison Way Surgery,2022-05-21,1.0,"Disappointed
    ",i am very disappointed to this surgery i came from india to uk before more than 1 year they never give me any appointment also i try to get appointment for cervical screening they told me to check blood pressure at home as well as today on 21st of may 2022 they give me an appointment which is at 09:00 a.m and 08:30 they call me for cancel an appointment and the reason was nurse not came today when i call them to take an appointment i already told them my work schedule not fix but specially for this appointment i took off and they told me call us again and we book your appointment again. they waste my time also my money i don't know why i paid for 2.5k for nhs. i was very upset for this and also for wasting my money ,disappointed surgery came india uk 1 year never give appointment also try get appointment cervical screening told check blood pressure home well today 21st may 2022 give appointment 0900 am 0830 call cancel appointment reason nurse came today call take appointment already told work schedule fix specially appointment took told call us book appointment again waste time also money know paid 25k nhs upset also wasting money
19,Mollison Way Surgery,2022-04-12,1.0,"Never actually able to see a GP
    ","i have tried to arrange an appointment for my elderly father with this gp surgery but the is never seen by an actual gp just nurses. he has a long term chronic illness. this gp surgery have written him off, i believe. terrible service always fobbed off on the phone or told to use the dr iq app but even then seen by a nurse never a gp",tried arrange appointment elderly father gp surgery never seen actual gp nurses long term chronic illness gp surgery written off believe terrible service always fobbed phone told use dr iq app even seen nurse never gp
20,Mollison Way Surgery,2022-04-04,1.0,"Doctor never available, receptionist poorest manners
    ","for the last 15 years i’ve only managed to see a nurse once, and that they were only interested to see me because i must have been classified an dominant patient who records would be closed and no payments for them. 

when i needed antibiotics for a chest infection that has been ongoing for over 2 weeks i was told no appointment, self isolate and go to app! appalling, i would not even recommend them to my worst enemy! close this surgery down! ",last 15 years i’ve managed see nurse once interested see must classified dominant patient records would closed payments them needed antibiotics chest infection ongoing 2 weeks told appointment self isolate go app appalling would even recommend worst enemy close surgery down
21,Mollison Way Surgery,2022-03-09,5.0,"Great practice
    ","the staff is friendly and quite efficient. that's not the best part of it, there was one error somewhere as my fit note was sent to my email and i have not received it, everyone was shocked i haven't received it and i was shocked it was sent already. i had blood tests and the results were ready within less than a week which i found impressive. when reaching for help for multiple problems the doctor called me back within a couple of hours, they were very empathetic and they listened properly to my problems. within minutes they have messaged me useful links to solving my problems, they have referred me for another medical issue, also after submitting a few medical requests and problems thru the app they came back with solutions to my problems the same day. for people that maybe didn't  the same experience, please keep in mind i was in a crisis situation and i was in need of urgent help. being in the middle of a crissis and feeling very anxious i was completely overwhelmed by the proffesionalism and kindness i was shown.",staff friendly quite efficient thats best part it one error somewhere fit note sent email received it everyone shocked received shocked sent already blood tests results ready within less week found impressive reaching help multiple problems doctor called back within couple hours empathetic listened properly problems within minutes messaged useful links solving problems referred another medical issue also submitting medical requests problems thru app came back solutions problems day people maybe experience please keep mind crisis situation need urgent help middle crissis feeling anxious completely overwhelmed proffesionalism kindness shown
22,Mollison Way Surgery,2022-02-24,1.0,"Poor reception staff
    ","i completed a review on doctor iq and the result indicated i needed to see my doctor.  after a 30 min wait on the phone i was advised they could do nothing and to go to a pharmacy.  i went to the pharmacy and was advised to go to my gp.  i called my gp and got a rude individual who told me there were no appointments for a week and ended my call.  i was in pain due to an ear infection and had to book a private doctor and was able to get the antibiotics needed.   once again if you need help, you got to pay for it.   i found reception person very poor and i hope the nhs contract is not renewed, only way to get ride of them",completed review doctor iq result indicated needed see doctor 30 min wait phone advised could nothing go pharmacy went pharmacy advised go gp called gp got rude individual told appointments week ended call pain due ear infection book private doctor able get antibiotics needed need help got pay it found reception person poor hope nhs contract renewed way get ride
23,Mollison Way Surgery,2021-11-18,1.0,"Fine for repeat prescriptions but not much else
    ","i have had no issues with sorting out repeat prescriptions here, but for anything to do with womens health. on more than one occasion i have felt dismissed when bringing up womens health - in on case when trying to book and appointment and in another actually in the appointment. it seems this isn't an area they are taking at all seriously which is incredibly disappointing, especially when talking to another woman.",issues sorting repeat prescriptions here anything womens health one occasion felt dismissed bringing womens health  case trying book appointment another actually appointment seems area taking seriously incredibly disappointing especially talking another woman
24,Mollison Way Surgery,2021-11-01,5.0,"Great doctor and medical staff
    ","excellent phone consultation with a doctor and another member of medical staff, today. both patient and reassuring and above all, kind. ",excellent phone consultation doctor another member medical staff today patient reassuring all kind
25,Mollison Way Surgery,2021-08-28,1.0,"Very poor service of GP
    ","very poor service and staff is totally unsupportive  never get appointments on time and all the time struggling all the time they told us contact to the hospital or we don’t have appointments it’s fully booked ,i think then no meaning of gp..
i do not recommend this gp .. going to change soon..
thanks .",poor service staff totally unsupportive never get appointments time time struggling time told us contact hospital don’t appointments it’s fully booked i think meaning gp recommend gp  going change soon thanks 
26,Mollison Way Surgery,2022-01-21,4.0,"My local GP - Good services
    ",this has been my local gp for the past few years and i am all-in-all pleased with the services provided. i am a type 1 diabetes sufferer and i was given a very good level of attention and help from the gp i usually book with which has resulted in my hospital referral. my only problem is with waiting times in the phone queue when calling in which can drag on.,local gp past years allinall pleased services provided type 1 diabetes sufferer given good level attention help gp usually book resulted hospital referral problem waiting times phone queue calling drag on
27,Mollison Way Surgery,2021-02-26,5.0,"Fantastic Service 
    ","i had 5 separate appointments with the nurse. she was very efficient informing me of what she was going to do, apologised for hurting me but it was not her it was the medication.  i was impressed with her approach. she is very caring, gentle and has a beautiful smile. i would put my life in her safe and gentle hands. thank you nurse. ",5 separate appointments nurse efficient informing going do apologised hurting medication impressed approach caring gentle beautiful smile would put life safe gentle hands thank nurse
28,Mollison Way Surgery,2021-02-26,5.0,"Lovely
    ","i recently moved to mollison way from another practice. i’ve found the staff to be knowledgable, polite and friendly, there are little to no wait times and i’ve been able to speak to someone on the phone or via the app every time i’ve needed to. when i came in today, the nurse who saw me was brilliant, especially when i expressed my phobia of needles - she was kind, reassuring and took my blood very efficiently. i’d definitely recommend this practice to others.",recently moved mollison way another practice i’ve found staff knowledgable polite friendly little wait times i’ve able speak someone phone via app every time i’ve needed to came today nurse saw brilliant especially expressed phobia needles  kind reassuring took blood efficiently i’d definitely recommend practice others
29,Mollison Way Surgery,2021-02-26,5.0,"Great experience 
    ",i was for a blood test to the surgery. the staff was really helpful and friendly. was comfortable to be there ,blood test surgery staff really helpful friendly comfortable
30,The Pinn Medical Centre,2022-12-13,2.0,"Patchs system closes too quickly
    ",the patchs  system is closed for most of the day. why can’t a request for an appointment be made at any time? it’s them up to the surgery to schedule it according to their resource availability. but not to even allow a request to be made beyond 9am or so is unacceptable. very poor service process which works for the surgery staff but not for its patients. ,patchs system closed day can’t request appointment made time it’s surgery schedule according resource availability even allow request made beyond 9am unacceptable poor service process works surgery staff patients
31,The Pinn Medical Centre,2022-12-08,4.0,"Good practice 
    ",electronic check in. short delay seeing gp. dealt with efficiently and effectively. appropriate tests scheduled by helpful receptionist. overall a good experience. ,electronic check in short delay seeing gp dealt efficiently effectively appropriate tests scheduled helpful receptionist overall good experience
32,The Pinn Medical Centre,2022-12-06,2.0,"Patches system for requests is completely unacceptable
    ","getting on patches to submit a request is almost impossible - each time over last 2 days, it said it had reached its limit, and would reopen in 1 hour. i finally managed to get on, only to be kicked out again after filling in the first screen, as it had reached its capacity!  i used to think pinn medical was very busy, but overall great.  this is no longer the case.   getting through to them is now almost impossible.  ",getting patches submit request almost impossible  time last 2 days said reached limit would reopen 1 hour finally managed get on kicked filling first screen reached capacity used think pinn medical busy overall great longer case getting almost impossible
