,clinic,date,rating,title,comment,comment_wo_stopwords
122,Oak Lodge Medical Centre,2022-10-27,1.0,"Bad
    ","i waited 40 minutes on a phone call to make my appointment, because they only make appointments via phone, when it was my turn, they hung up.  i called again and spent 25 minutes to be number 1 in the queue and another 1 hour waiting to be answered.  when they saw me, they said there was no room to see the doctor.  i've been calling every day for a week and it's always the same thing...they drop the call or when they answer they don't have a time and when they give you the option to call you back, they don't return...when you go there in person, they say they can't make an appointment in person.",waited 40 minutes phone call make appointment make appointments via phone turn hung up called spent 25 minutes number 1 queue another 1 hour waiting answered saw me said room see doctor ive calling every day week always thingthey drop call answer time give option call back returnwhen go person say cant make appointment person
123,Oak Lodge Medical Centre,2022-10-15,1.0,"Opening times.
    ",the receptionist gave me a small bottle to pee in on saturday morning for my diabetic review and hand it in on saturday by the desk. how ever they don't open on saturday morning like they use. i did ask the receptionist if i can do it here in th surgery and she said no. you have to take it home & do it. bring it in the next day. the next day is saturday morning which they don't open. now i have to wait til monday afternoon after i've finish work to bring my example in. what happen to these receptionists as they don't have a clue what they are doing in there job roles.,receptionist gave small bottle pee saturday morning diabetic review hand saturday desk ever open saturday morning like use ask receptionist th surgery said no take home  it bring next day next day saturday morning open wait til monday afternoon ive finish work bring example in happen receptionists clue job roles
124,Oak Lodge Medical Centre,2022-09-29,1.0,"Duty of care lacking
    ","i've always found the receptionists at this practice to be polite and civil. though i do think they brace themselves for possible abuse which is understandable as they are so stretched. 
what isn't acceptable is the admin side. i now order my prescriptions through the nhs app, the problem is that one essential prescription is missing and has been since august 2022. 
i've emailed every week and rung so many times and have had to hang up. this morning i was 'number 3 in the queue' and had to hang up after 40 minutes. not all of us can afford to hold on for that length of time. 
whoever looks after the admin side is seriously lacking. i should also point out that i've had problems pre covid with my prescriptions. 
one other thing i noticed on my last visit is that the room on the very far right down the corridor, as you walk in from the waiting room, reeks of smoke. strong enough to make your eyes water. all workplaces i know of shove smokers into the street for their smoking break. is there a smoking room in the practice?",ive always found receptionists practice polite civil though think brace possible abuse understandable stretched acceptable admin side order prescriptions nhs app problem one essential prescription missing since august 2022 ive emailed every week rung many times hang up morning number 3 queue hang 40 minutes us afford hold length time whoever looks admin side seriously lacking also point ive problems pre covid prescriptions one thing noticed last visit room far right corridor walk waiting room reeks smoke strong enough make eyes water workplaces know shove smokers street smoking break smoking room practice
125,Oak Lodge Medical Centre,2022-08-02,1.0,"Rude receptionist 
    ","they open the surgery at 8:30, but you can try to call 1-2 mins prior to avoid the long queue, which i did. someone answered at 8:29 really rude and did not even let me finished. i had already sent an e consult so the doctor was aware already of my issue, so i just needed a face to face appointment..she didn’t want to listen and hang up on me. i’ve called again at 8:30 to be put on a long queue of more than 30 people. this is a joke. they always had a problem with the reception part. the doctors and other staff are ok and really understanding..yet they should invest more in the reception training since i know i’m not the only person dealing with this.",open surgery 830 try call 12 mins prior avoid long queue did someone answered 829 really rude even let finished already sent e consult doctor aware already issue needed face face appointmentshe didn’t want listen hang me i’ve called 830 put long queue 30 people joke always problem reception part doctors staff ok really understandingyet invest reception training since know i’m person dealing this
126,Oak Lodge Medical Centre,2022-08-09,2.0,"Rude and unhelpful receptionist
    ","was in a queue of over 30 people and a wait time of over 40 minutes only to be told i had to go on their website (which doesn't exist) and fill in an admin form on there.
i explained that a blood test was needed (i attended a walk-in recently and was advised i needed a blood test but my gp had to sign off the referral) and the receptionist was trying to question this and said they don't do blood tests at the gp surgery - this isn't what i was asking for!
i can understand being under extreme pressure but questioning someone as to why they need to see a doctor without any medical knowledge or medical training isn't the right way to go about things",queue 30 people wait time 40 minutes told go website which exist fill admin form there explained blood test needed i attended walkin recently advised needed blood test gp sign referral receptionist trying question said blood tests gp surgery  asking for understand extreme pressure questioning someone need see doctor without medical knowledge medical training right way go things
127,Oak Lodge Medical Centre,2022-10-05,1.0,"The worst GP!!
    ","i have waited for a sick note for weeks now. i contacted the gp in august regarding my ankle and spent hours on the phone trying to get through. after many trials i eventually got through to the receptionist and managed to get a doctor to call me - i was told that a sick note would be sent over ""shortly"". we are now in october and i still have not managed to get the sick note despite chasing them several times. not  to mention it is almost impossible to get through to anyone and even now i was on the phone for nearly an hour only for someone to cut the line on me when i was ""caller number 1"". this gp is by far the worst and as an nhs worker myself i am utterly disappointed with the level of service they provide. please avoid avoid avoid!!!",waited sick note weeks now contacted gp august regarding ankle spent hours phone trying get through many trials eventually got receptionist managed get doctor call  told sick note would sent shortly october still managed get sick note despite chasing several times mention almost impossible get anyone even phone nearly hour someone cut line caller number 1 gp far worst nhs worker utterly disappointed level service provide please avoid avoid avoid
128,Oak Lodge Medical Centre,2022-07-26,5.0,"Caring and Responsive
    ","we always experience responsive, caring and professional support, particularly as my mother has complex health needs.",always experience responsive caring professional support particularly mother complex health needs
129,Kenton Clinic,2022-11-03,5.0,"Excellent Practice & Quick Response
    ","i have recently registered with the gp & my experience till date has been great. i have been timely given the appointment & treated with utmost care and urgency. the staff is very friendly, helpful and polite. i have got appointments on short notice also when there was an emergency and doctor gave the right set of treatment and medication which healed my wound. i am very happy that i chose this gp.  ",recently registered gp  experience till date great timely given appointment  treated utmost care urgency staff friendly helpful polite got appointments short notice also emergency doctor gave right set treatment medication healed wound happy chose gp
130,Kenton Clinic,2022-06-30,5.0,"excellent practice 
    ","very caring and meticulous in treatment. 
very quickly make referrals to specialists for fuller diagnosis.",caring meticulous treatment quickly make referrals specialists fuller diagnosis
131,Kenton Clinic,2022-04-28,4.0,"Great Service/Practice
    ","as a hearing impaired individual i have had a smooth and efficient experience in service provided by the receptionist, nurse and doctors. telephone conversations were clear and concise when booking appointments and speaking to doctors was very informative and helpful. the doctor was very respectful and shared genuine concern/care for myself and family members who had been diagnosed with illness etc. and we never felt like ""another number in the book"". ",hearing impaired individual smooth efficient experience service provided receptionist nurse doctors telephone conversations clear concise booking appointments speaking doctors informative helpful doctor respectful shared genuine concerncare family members diagnosed illness etc never felt like another number book
132,Kenton Clinic,2022-03-10,5.0,"Very efficient and patient friendly practice
    ","i was able to get through to gp with ease because of caring and efficient staff. i was able to see my desired gp within a day. doctor gave me enough time,listened to my problems with care and concern. at no time i felt rushed. the doctor and all the staff are very helpful and reassuring which put my mind at ease.
i have been with kenton clinic for more than 45 years and i must say without any exaggeration that this is the best clinic in harrow.

thanks for the dedicated doctors and staff.👍",able get gp ease caring efficient staff able see desired gp within day doctor gave enough timelistened problems care concern time felt rushed doctor staff helpful reassuring put mind ease kenton clinic 45 years must say without exaggeration best clinic harrow thanks dedicated doctors staff👍
133,Kenton Clinic,2022-02-18,5.0,"Great GP
    ","spoke to my gp via voice call and he asked me to come in straight away. 
follow up appointment to check up on me next week. 
very happy with the appointment and very friendly staff! ",spoke gp via voice call asked come straight away follow appointment check next week happy appointment friendly staff
134,Kenton Clinic,2022-02-06,4.0,"Always there when I need them
    ","i've been registered with this clinic for over 30 years and the team have always been there to help me. they have my full trust and i cannot recommend this gp surgery more highly, they are a credit to the nhs.",ive registered clinic 30 years team always help me full trust cannot recommend gp surgery highly credit nhs
135,Kenton Clinic,2021-12-23,5.0,"Great GP 
    ","i have been with kenton clinic for the past 4 years and they are very professional and friendly . my both childrens are always happy when they need to be seen by the doctor because he is very friendly and kind. 
today i've had an telephone consultation regarding my sons year pain with the doctor and immediately requested to attend the clinic even if he didn't have an appointment.
thank you ",kenton clinic past 4 years professional friendly  childrens always happy need seen doctor friendly kind today ive telephone consultation regarding sons year pain doctor immediately requested attend clinic even appointment thank
136,Kenton Clinic,2021-12-22,5.0,"Great practice
    ",the best doctor and the best care in the area. very patient friendly surgery. very supportive doctors n staff. during my husband’s illness we were immediately referred to right place. very kind and listening  and caring.,best doctor best care area patient friendly surgery supportive doctors n staff husband’s illness immediately referred right place kind listening caring
137,Kenton Clinic,2021-11-19,5.0,"Disability Friendly 
    ","as a bsl user the surgery had arrange for a bsl interpreter for me, the appointment was pretty much on time, the dr and staff worked well with me and the interpreter, i felt the dr understood my problems and gave me advice on what i can do. i left feeling happy with the service i had received. the receptionist made a follow up appointment and this was text to my phone. good surgery to be with.",bsl user surgery arrange bsl interpreter me appointment pretty much time dr staff worked well interpreter felt dr understood problems gave advice do left feeling happy service received receptionist made follow appointment text phone good surgery with
138,Kenton Clinic,2021-09-15,5.0,"Wonderful GP
    ","i have been with kenton clinic all my life, and i must say that the care and support is always top notch. all my concerns are always addressed and i feel very comfortable to discuss any problems every time i visit. would definitely recommend to family and friends. :d",kenton clinic life must say care support always top notch concerns always addressed feel comfortable discuss problems every time visit would definitely recommend family friends d
139,Lane End Medical Group,2022-11-14,5.0,"Very caring medical and support staff
    ",doctor reviewed very quickly the photos i had sent him and immediately set up a face to face session the next working day. he took care to answer all my concerns.,doctor reviewed quickly photos sent immediately set face face session next working day took care answer concerns
140,Lane End Medical Group,2022-10-27,5.0,"Great practice
    ","phone for advice on male breast cancel. i was phone by clinici within  2 mins. he answered my concerns, laid out facts and answered all my queries highest of standards",phone advice male breast cancel phone clinici within 2 mins answered concerns laid facts answered queries highest standards
141,Lane End Medical Group,2022-11-06,3.0,"Great nurse, gentle bedside manner 
    ","the nurse for my women's health appointment and my daughters' flu shots was kind, gentle, polite, helpful and explained everything very clearly. great bedside manner too! thank you for the great service. ",nurse womens health appointment daughters flu shots kind gentle polite helpful explained everything clearly great bedside manner too thank great service
142,Lane End Medical Group,2022-10-04,5.0,"Exceptional Practise and Care
    ","doctors are efficient and caring, doing their utmost to resolve and treat any condition. they are sensitive to the needs of their patients taking all details on board. all the doctors are extremely thorough with their examinations and diagnosis. most recently an ultrasound was reviewed and followed up within two hours of the hospital appointment. an outstanding service and surgery that we trust to take care of all our health needs. thank you to all staff at lane end, your hard work is appreciated. ",doctors efficient caring utmost resolve treat condition sensitive needs patients taking details board doctors extremely thorough examinations diagnosis recently ultrasound reviewed followed within two hours hospital appointment outstanding service surgery trust take care health needs thank staff lane end hard work appreciated
143,Lane End Medical Group,2022-09-20,5.0,"Excellent practice
    ","the drs have nearly always been top class.
reception was the weak point for a few years. the latest recruits however are welcoming, bright, friendly and kind making it an all round great practice at last.",drs nearly always top class reception weak point years latest recruits however welcoming bright friendly kind making round great practice last
144,Lane End Medical Group,2022-09-15,5.0,"Efficient practice 
    ",the receptionist was very efficient and the gp was very helpful. she listened to me and suggested a plan and arranged for an appointment to review and discuss my concerns.,receptionist efficient gp helpful listened suggested plan arranged appointment review discuss concerns
145,Lane End Medical Group,2022-09-16,5.0,"Careful practice 
    ",the nurse was thorough with the questions. i asked questions and she was happy to answer. i asked about the frequency of using the eye drops. she is only allowed 10 minutes of consultation.,nurse thorough questions asked questions happy answer asked frequency using eye drops allowed 10 minutes consultation
146,Lane End Medical Group,2022-10-13,4.0,"To consult medical advise  
    ","saw 
the  nurse who gave some advise and suggested further investigation and put in motion further consultation with an appropriate clinic ",saw nurse gave advise suggested investigation put motion consultation appropriate clinic
147,Lane End Medical Group,2022-10-04,5.0,"Very friendly caring practice
    ","these are my mum’s gps. i find all the staff very caring polite and efficient at their job. the receptionists are always willing to help with any queries i may have. then when you get to talk to the gps, again they are the same. they will refer my mum to anywhere that may help her. as she is 85years old, her needs are varied and complicated. if i have a worry about a referral or need advice in a particular situation, they are always willing to help. i know they are very busy in this practice but i am very happy with the care they provide for my mum.
i have to ring 8:30am to get an appointment and sometimes even at that time, there are 10 people ahead of me( i am not sure how that happens) so i know they are a very busy practice but somehow they manage to deliver a great service. i would like to thank everyone working in the practice from both of us- my mum and myself for taking such good care of her.",mum’s gps find staff caring polite efficient job receptionists always willing help queries may have get talk gps same refer mum anywhere may help her 85years old needs varied complicated worry referral need advice particular situation always willing help know busy practice happy care provide mum ring 830am get appointment sometimes even time 10 people ahead me sure happens know busy practice somehow manage deliver great service would like thank everyone working practice us mum taking good care her
148,Lane End Medical Group,2022-07-27,1.0,"Disasters practice
    ",i am over a year patient of this practice and trying to get an appointment with them and receptionist always sorry can’t give me appointment . i was in and out of the hospital this year bur can’t get an appointment with gp to see what is wrong with me!!! this is disasters practice place. this people don’t care about anyone. i need to change my gp but i am living in their postcode area so you say what i need to do?????? ,year patient practice trying get appointment receptionist always sorry can’t give appointment  hospital year bur can’t get appointment gp see wrong me disasters practice place people don’t care anyone need change gp living postcode area say need do
149,Lane End Medical Group,2022-01-19,2.0,"Totally in efficient 
    ","great if you want a corona virus booster but if you are a patient of the practice it is unrecognisable!!
can't go into make appointment. the only profession that is nearly impossible to visit. if you want to make an appointment you have to phone on the same day. thats if you have alot of time on your hands to hang on. is that what doctors qualified for. its hard to understand how the government has let them get away with it. ",great want corona virus booster patient practice unrecognisable cant go make appointment profession nearly impossible visit want make appointment phone day thats alot time hands hang on doctors qualified for hard understand government let get away it
150,Lane End Medical Group,2022-02-01,5.0,"Really quick and efficient 
    ","very courteous and organised. quick and thorough doctor chrck, jab was not too painful. great staff   ",courteous organised quick thorough doctor chrck jab painful great staff
151,Lane End Medical Group,2022-01-16,5.0,"Great Experience 
    ",i went for my covid booster jab and the whole process was quick and easy! the staff were friendly and caring and explained everything well. thank you! ,went covid booster jab whole process quick easy staff friendly caring explained everything well thank you
152,Lane End Medical Group,2021-12-13,5.0,"Well run Covid booster vaccine clinic
    ",i attended a sunday morning clinic for my booster jab.  everything was very well planned and i moved through the process extremely quickly.  very impressed.,attended sunday morning clinic booster jab everything well planned moved process extremely quickly impressed
153,Lane End Medical Group,2021-11-20,5.0,"Covid Booster Vaccine - smooth booking process
    ","i booked my covid booster via patient access - online following on from a prompt text message 6 months after my second jab. 

there was plenty of slots available during the saturday clinic.

i arrived to a queue of about 8 people and was seen to quickly and efficiently.

i was given the vaccine on time exactly and waiting in the waiting area for 15 mins - there was not enough chairs and this was quickly resolved so that everyone was offered a seat.

the vaccine was completely painless.

",booked covid booster via patient access  online following prompt text message 6 months second jab plenty slots available saturday clinic arrived queue 8 people seen quickly efficiently given vaccine time exactly waiting waiting area 15 mins  enough chairs quickly resolved everyone offered seat vaccine completely painless
154,Lane End Medical Group,2021-12-12,5.0,"Fantastic Care
    ","having been a member of this gp for the past 6 years. i have always received outstanding care for myself and my family. 
this has continued during the pandemic, during which we have had occasion to seek medical advice multiple times. i cannot praise highly enough the calm and caring nature of the receptionists and the excellent medical care of the doctors. we have also received our vaccinations through the surgery and were impressed with the systems in place and the efficiency and caring of all staff. thank you ",member gp past 6 years always received outstanding care family continued pandemic occasion seek medical advice multiple times cannot praise highly enough calm caring nature receptionists excellent medical care doctors also received vaccinations surgery impressed systems place efficiency caring staff thank
155,Lane End Medical Group,2021-10-02,5.0,"Covid vaccination
    ","superbly organised. very efficient 
attended for my booster and including the waiting time post injection was out of building in 20 minutes.  everyone was friendly and directed you to right place kindly. thank you for making the experience a pleasant one",superbly organised efficient attended booster including waiting time post injection building 20 minutes everyone friendly directed right place kindly thank making experience pleasant one
156,Lane End Medical Group,2021-10-05,5.0,"Very professional and caring practice
    ","attended for my booster covid vaccination on 2/10/21. received  kindness, care and consideration from all staff on duty. ",attended booster covid vaccination 21021 received kindness care consideration staff duty
157,Lane End Medical Group,2021-10-03,5.0,"3rd covid vaccination
    ","excellent in every way.  organised, efficient, good humour. we were seen within a few minutes of appointment time.  checks were carries out and procedures fully explained, all with patience and good humour.",excellent every way organised efficient good humour seen within minutes appointment time checks carries procedures fully explained patience good humour
158,Lane End Medical Group,2021-10-03,5.0,"covid Vaccine No.3
    ",came yesterday 2.10.21. for covid booster no.3. extremely well organised. lots of staff. all very polite. couldn't want better,came yesterday 21021 covid booster no3 extremely well organised lots staff polite want better
159,Lane End Medical Group,2021-10-01,2.0,"poor managed 
    ","i filled econsult for urgent pain killers. after waiting for 24 hrs to get a response, the response i got is that the surgery has not received an ae discharge letter and can't provide urgent medication, i should provide copy of the ae discharge letter. now i need to fill another econsult to provide a letter which i don't have it as an attachment.",filled econsult urgent pain killers waiting 24 hrs get response response got surgery received ae discharge letter cant provide urgent medication provide copy ae discharge letter need fill another econsult provide letter attachment
160,Lane End Medical Group,2021-10-04,5.0,"Always given due care and consideration
    ",i had my booster covid 19 and flu vaccination on saturday 2nd october. the organisation and care shown to me was excellent by all concerned. ,booster covid 19 flu vaccination saturday 2nd october organisation care shown excellent concerned
161,Lane End Medical Group,2021-10-02,5.0,"Organised practice
    ","very wellcome & good, service with a smile.
well organised and good communication with patience.
prompt and satisfactory solutions without delay",wellcome  good service smile well organised good communication patience prompt satisfactory solutions without delay
162,Lane End Medical Group,2021-10-02,5.0,"COVID booster
    ",so very well organized practically and handled by such kind and courteous people. an example of how it should be done. ,well organized practically handled kind courteous people example done
